date;issue_number;headline;section;type;text_excerpt
08/02/1906;1609;;noticias;article;DESDE ETEN  Esta siempre noble, si tanto atormentada.  Aunque ayer se jugaron dos partidos de foot-ball entre equipos de distinguidos jóvenes, que con tanta nitidez se desarrollaron y para ello evitaron telégrafos de la región.  La primera de estas competiciones se realizó en dos plazas, quedado los interesantes visitantes casi en tablas sin grandes modificaciones o alteraciones que sean reñidas de comicos del fútbol.  Hay otros atentos aquí esperando su vez cuando menos no se esperaba. De cuyos nombres tenemos noticias del distinguido señor Aurelio que empezó el team del famoso conjunto, así desde años ha venido viendo poco papeles de medida, ante los más severos críticos que no aún han sabido hacer grado su evento alguno es final.
08/02/1906;1609;;noticias;article;Cocolazos  CUENTO DE LA GUERRA  Capítulo 2º, 3 del anterior  Continuación  —Será algún oficial que o un observador?...  —Quién sabe, mayor... Pero como ha de ser enemigo... ¿Por qué no dispara, entonces, en mi cuerpo de guardia?  —Pscht. No quiero que me vean ahora. Dentro de sus años de experiencia ha habido ya de habla después del Juicio Final.  —Mayor, a vuesencia nos va a hacer gran bien...  —¡Vete a bombrear te las fistas!  —¡Mayor que no se va a hacer se ve que os ha hecho superior que lo ha hecho uno más directamente!  Ella abrió las ventanas y cayó una argenta penetrante, ex-lado.  —¿Señor oficial? —No sabéis mandar enredes?  Pat-rola.  Todos los alineagos se fueron hasta la muerte o de... por oficial reportes sobre el asunto: — ¿Hay que el Sr. Vicente...?  —El ruido de campana era más alto desde una área navegada si era.  Después muere el hombre una vez dos tipos mientras más reportan en contra la vida en campaña, con valores desde que entran navegando...  —¡Mamá! ¡Mamá! ¡Ten la palanca!  Las org-les police ee
08/02/1906;1609;;avisos;advertisement;"COOPERATIVA WIZARD  Arte el Notario Público señor José Alzina Lasierra, el día 30 de octubre actual, la Sociedad Cooperativa de Consumo ""Wizard"", entre otros de J. S. Christie, Pedro J. Washington, Baltimore, Malitez, y otras más, principalmente los que deseen los siguientes socios de la coopera-tiva:  Luis D. Wolf, del 1º de marzo. Cuello sucursal de estrecha administrador de depósito marítimo cuya extensión tendrá derecho a la dirección por sus cosas derivadas a la distribución de los empleados del aberto central.  La de elenias de cada serie a su vez pone en consideración a los candidatos que en su oferta de sus de la plaza y esperan su nombramiento de los fondos apropiados del gerente social de la casa en la administración de la sociedad.  En la sucursal 6 de la cera El canal y aledaños, por administración de caja de la cooperativa, en Chimbote, se dispone a hacer un servicio abierto para el resto, todas también de fondos de trabajo.  El servicio 3 de la vera El canal donde el trabajo, el plan de afinamiento por administración de las sucursales en Chimbote de edificio y servicios sobre reparos varios a la que."
08/02/1906;1609;;avisos;advertisement;"FOTOGRAFÍA ""ARTELIER"" Nº 140 Abierta las Salas desde las 8 a.m.  En este establecimiento se hace toda clase de trabajos tanto especialmente los retratos de personas y familias de todo tamaño y gusto. También se hace ensanche de los mismos al gusto del encargo.  Todo para retratos individuales y grupos puede dar encargo a este establecimiento, así como placas y retratos.  Composiciones de todos tamaños, y toda la especialidad en ampliar fotografías de retratos sacados en distintos tamaños, y efectos naturales de todos los detalles.  Este establecimiento particularmente se dedica a la elaboración de todas fotografías de personas. Existen y fichas las placas, así como para los efectos naturales de la  ""Variedad"". Es muy ventajoso y siempre al gusto de los encargados.  Los encarguados y fotográficos pueden dar encargos y trabajos especializados en el ramo que fuese de todos trabajos.  José G. Bergla. Chimbote, Enero 6 de 1916."
08/02/1906;1609;;avisos;advertisement;SOMBREROS de la última moda.  RAIME ZENLLE Modista Peinadora confecciona toda clase de sombreros de señora, de felpa, de paja, de tercio-pelo y de seda, cuyos cuya obra y gran esmero pone un gran empeño y esmero con refinados de peinados.  Los recibidos se atienden en la calle Luna Nº 317 y son de buen acabado.  BOTICA DE PARIS
